Publication Date,Summary,Sentiment Polarity,Sentiment Confidence,Keywords,stock_date,stock_price,percentage_change
2024-03-08,"Pharmaceutical companies behind weight-loss drugs are slimming down a new target: The Magnificent 7
 Happy Friday! In today's big story, we're looking at pharma companies' surging stocks and threatening tech darlings thanks to their weight-loss drugs.
   Hannah Latham; Octavio Jones; Christian Rodriguez; Laura MacPherson; Jenny Chang-Rodriguez/BI
  Not unlike artificial intelligence, which has pushed tech stocks higher, the weight-loss drugs fueling pharmaceuticals' recent rally have their critics.
   Shares of Novo Nordisk, the drug maker behind Wegovy, surged to a record high following an update on a new obesity drug, pushing its market cap ranking past Magnificent 7 laggard Tesla.
   The big story
  Magnificent weight loss
   AP
  Weight-loss drugs have become a trendy way to shed pounds in recent years.",neutral,1,"sell-side, Christian, George Glover, Octavio Jones, Biden, earnings growth, fat, market data, Tesla, market, Jordan, R2, Rivian, The Insider, market cap, bank, MacPherson, GLP-1, JPMorgan, Meta
  Check, protein, iPhone, pharma, Christian Rodriguez, things, Atlantic, Goldman Sachs, Apple, stern, minding, Drug, Business Insider, RJ Scaringe, investors, Temu, Eli Lilly, GDP, Pete Ryan, Insider Today, China, Barry Sternlicht, Infrastructure Investment, Musk, Disney, Laura MacPherson, Novo Nordisk, weight loss, Donald Trump, real estate, White House, Congress, McDonald, CEO, Magnificent 7, R3, Market, Hannah Latham, European Commission, New York, ecommerce, pharmaceutical companies, Getty Images, Microsoft, memory, Weight, Chinese, The Atlantic, Pfizer, Magnificent, weight, drugs, Elon Musk, Inflation, companies, Nike, Hallam Bullock, loss, TikTok, Joe Biden, London, billionaire, AP, year, Mag 7, Nvidia, Yuheng Zhan, Fed, business, crown, US, President, BI, Fernando Gutierrez-Juarez, Mom-and, artificial intelligence, muscle, Expectations, Wall Street, Jobs Act, Bike lanes, Jenny Chang-Rodriguez, obesity, Dan DeFrancesco, economist",2024-03-09,175.34,0.0
2024-03-09,"A caravan of Crybertruck drivers' public catastrophes are challenging Tesla's already fragile reputation. Tesla CEO Elon Musk tweeted a video of a …
 Kevin Beachus flipped this story into Tesla",negative,0.72,"Beachus, Kevin, Musk, SpaceX, video, Future, Threat, Elon Musk, caravan, Crybertruck, Kevin Beachus, CEO, Tesla, tweeted, drivers",2024-03-10,177.77,1.3252016301405096
2024-03-09,"Experts have speculated why the $80,000 electric vehicle lost to the Silverado

At one point, the Cybertruck does manage to pull the Silverado but only when the diesel car is in park mode

A Youtube channel release a video showing Twitter boss Elon Musk's Cybertruck being dragged by a diesel Chevy Silverado on its first attempt

Twitter boss Elon Musk's Cybertruck has been put to the test in a new video showing a game of tug-of-war with a Chevy Silverado.

 At one point, the Cybertruck does manage to pull the Silverado but only when the diesel car is in park mode

With a rising number of cases of bad press and dangerous incidents, the release of this YouTube video has only made matters worse for the $80,000 Cybertruck

Earlier this week, a Cybertruck driver crashed into an iconic Beverly Hills Hotel and ended up asking Musk for a new one after blaming the hotel's valet service.

 Can you help out in getting another??'

Musk, responded to the post and weighed in on the crash, saying 'Tesla supertruck with crazy torque, dynamic air suspension, and corners like it's on rails.'

A Tesla Cybertruck driver crashed into the iconic Beverly Hills Hotel and asked Elon Musk for a new one after blaming the hotel's valet service

A post on X included a dramatic photo of the futuristic car wedged right below the fancy hotel's infamous sign

Musk, responded to the post and weighed in on the crash, saying 'Tesla super truck with crazy torque, dynamic air suspension, and corners like it's on rails'

 The video shows the truck giving up on its first attempt and allowing the Silverado to drag the 5,500-pound EV behind it

At one point, the Cybertruck does manage to pull the Silverado but only when the diesel car is in park mode.

 One such video released by YouTube channel Cyber Hooligan shows the Cybertruck competing against a diesel Chevy Silverado pickup and losing

",neutral,0.94,"Tesla, Beverly Hills, crash, diesel, Ford, tug-of-war, YouTube, truck, Youtubers, Silverado, Chevy Silverado, department, Cyber Hooligan, air suspension, vehicle, stainless steel, torque, InsiderEV, Dorchester Collection, Nevada, @elonmusk, Moments later, Elon Musk, park, valet, Ford F-150, video, Musk, Tesla Cybertruck, Chevy, Cybertruck, drag, pound, brake, Youtube, sign, L.A, billionaire, Twitter, pickup, palm, hotel, Experts, @jackdidthatt, California, beach",2024-03-10,177.77,1.3252016301405096
2024-03-10,"Several hundred people demonstrated Sunday against plans by Tesla to expand its electric car factory near Berlin, citing environmental concerns.
 A smaller counter-protest was held Sunday in support of the Tesla factory, with participants citing economic benefits for the region.",neutral,0.63,"Germany, economic, electric car, Berlin, people, Sunday, expansion, support, Tesla, Several, participants, factory",2024-03-11,177.54,-0.1293806604039029
2024-03-10,"As on Thursday, Baidu Inc ADR (NASDAQ: BIDU) started slowly as it slid -1.58% to $97.81, before settling in for the price of $99.38 at the close. Baidu Inc ADR (BIDU) Earnings and Revenue Records  If we go through the results of last quarter, which was made public on 12/30/2023, the company posted $3.05 earnings per share (EPS) for the quarter, besting the agreed prediction (set at $2.48) by $0.57. Through scrutinizing the latest numbers posted by the [Baidu Inc ADR, BIDU], it can be observed that its last 5-days Average volume of 3.92 million was better the volume of 3.51 million, it posted the year before. Raw Stochastic average of Baidu Inc ADR (BIDU) in the period of the previous 100 days is set at 3.92%, which indicates a major fall in contrast to 7.02% during the last 2-weeks. Baidu Inc ADR's EPS decrease for this current 12-month fiscal period is -1.87% and is forecasted to reach 12.01 in the upcoming year.",neutral,0.88,"Raw, stock, Technical Analysis, days, EPS, volatility, PE, ATR, market, Quick Ratio, BIDU, Invest, Stochastic %D, Baidu, market capitalization, AI, Imagine, Baidu Inc, Buffett, Tesla, PE Ratio, last, Raw Stochastic, year, Diluted EPS, time, Communication Services, quarter, Revenue Records, NASDAQ, Company, Stock, Apple, Amazon, 12-month, Internet, Baidu BIDU, ADR, fiscal year",2024-03-11,177.54,-0.1293806604039029
2024-03-11,"The Cybertruck might not be as bulletproof as Elon Musk has advertised.   (During the vehicle's delivery event in November, Tesla also shared a video of the truck surviving a round of bullets from a .45-caliber Tommy Gun.)
  Nelson and a spokesperson for Tesla did not immediately respond to a request for comment.
   The metal also cracked all the way through when Nelson fired the .223-caliber AR-15 at the vehicle.
  While the truck didn't prove entirely bulletproof, Nelson said he was still impressed by its durability.
   The video from the .50-caliber gun shows the shot flying through the car door — which Nelson left open to avoid damaging the truck's interior — and taking a nickel-sized chunk out of the metal. In a video that was uploaded on Friday, Nelson shot the electric pickup truck with a series of guns, including an AR-15 and .50-caliber rifle.
  ",neutral,0.78,"YouTube, Zach Nelson, velocity, bulletproof glass, Elon Musk, rifle, pistol, Tesla, stainless steel, JerryRigEverything, steel, Tommy Gun, Joe Rogan, pickup truck, caliber, glass, bullet, Cybertruck, Sledgehammer, video, Business Insider, social media, handgun, YouTuber, vehicle, Musk, bulletproof, sledgehammer, Nelson, truck",2024-03-12,177.54,0.0
2024-03-11,"New-vehicle average transaction prices (ATP) in February 2024 declined from January and were lower year over year by 2.2%; new-vehicle ATPs are now down 5.4% from the December 2022 peak.





 Tesla Prices Rise, But EV Prices Continue to Decline

According to newly revised electric vehicle (EV) transaction price data, the average price paid for an electric vehicle in February was $52,314, down from a revised $54,863 in January, according to Cox Automotive and Kelley Blue Book estimates. We should also note that despite rising inventory, which is good for consumers, the levels are muted, not alarming.""

Higher Incentives Help Keep New-Vehicle Prices in Check

New-vehicle incentives in February averaged 5.9% of transaction price, up from 5.7% in January and significantly higher than the average of 3.1% recorded in February one year ago. ATLANTA, March 11, 2024 /PRNewswire/ -- New-vehicle transaction prices (ATP) in February 2024 held mostly steady, according to an analysis by Kelley Blue Book, falling less than one-tenth of 1% from the revised January ATP. View original content to download multimedia:https://www.prnewswire.com/news-releases/new-vehicle-average-transaction-prices-retreat-for-second-straight-month-according-to-latest-kelley-blue-book-estimates-302085581.html

SOURCE Kelley Blue Book",neutral,0.99,"Erin Keating, Audi, SAAR, February, Price Advisor, Prices Continue, Toyota, Tesla, Kelley, LinkedIn, Porsche, Rolls Royce, market, Mini, FleetNet America, Cox Enterprises, Infiniti, Ferrari, Atlanta, Automotive, insurance, Polestar, prices, Facebook, NextGear Capital, year, Cox-Automotive-Inc, Cox Automotive, peak, vehicle, Mercedes, Model 3, New-vehicle, Industry Insights, Blue, automotive dealers, multimedia, Service Advisor, Mitsubishi Mirage, Lexus, Kia Rio, Model Y, vAuto, Land Rover, Manheim, exotics, KBB.com, U.S, Affordability, ATP, Lamborghini, transact, CentralDispatch, Data, Luxury, ATLANTA, Best Cars, automotive industry, Mercedes G-Class, Cash Offer, Book",2024-03-12,177.54,0.0
2024-03-11,"Futuristic, startling or just weird, Tesla’s eye-catching Cybertruck has inspired different reactions and now the company is looking at the unique body repair techniques it demands.
 For example, to remove scratches from Cybertruck exterior body panels Tesla says:
 Refinish the entire plane (flat area) of the panel containing the repair area and the same plane across all panels on the same side of the vehicle to maintain consistency in appearance. “Pulling or pushing the body structure can damage the integrity of the component or the joint (including mechanical fasteners or adhesive) between structural components, including those in seemingly unrelated parts of the body structure,” Tesla states in its structural repair guidelines.
  The stainless steel body has light and deep cosmetic scratch repairability, according to the OEM’s repair procedures. Repairs on damaged body or structural components shouldn’t be performed near SRS components such as air bags, seat belts, impact sensors, and intrusion beams.",neutral,0.47,"repair, body, SRS, OEM, Australia, impact, panel, aluminum, aftermarket, US, Pulling, procedures, air, Cybertruck, steel, glass, corrosion, exoskeleton, components, stainless steel, Tesla, structure, baseball, panels, welding, Futuristic",2024-03-12,177.54,0.0
