Publication Date,Summary,Sentiment Polarity,Sentiment Confidence,Keywords,stock_date,stock_price,percentage_change
2024-02-13,"The closing price of Spero Therapeutics Inc (NASDAQ: SPRO) was $1.50 for the day, up 9.49% from the previous closing price of $1.37.
 In the most recent recommendation for the company, Evercore ISI on September 23, 2022, Upgraded its rating to Outperform and sets its target price to $8 from $2 previously.
  Also, insider trades can serve as a great indicator of what management thinks about the future direction of a stock's price. A recent insider transaction in this stock occurred on Feb 05 when Shukla Sath sold 45,093 shares for $1.45 per share. It provided that stocks Price–to–Cash (P/C) ratio for the trailing twelve months (TTM) is standing at 0.85 whereas its Price-to-Free Cash Flow (P/FCF) for the term is 2.74. For the stock, the TTM Price-to-Sale (P/S) ratio is 1.12 while its Price-to-Book (P/B) ratio in mrq is 1.48.",neutral,0.99,"stock, FCF, price, Long-Term Debt/Eq, stake, recent, Evercore ISI, TTM, Outperform, Imagine, ISI, Explodes
  Imagine, Shukla Sath, Apple, insider, P/E, fiscal year, JOSEPH, Price, 52-week, Ratio, EBITDA, Mahadevia Ankit, shares, ratio, Time, NASDAQ, Invest, PEG, Spirit Aerosystems, SPRO, Buffett, Spero, TTM Price, company, EPS, Float, The firm, Quick Ratio, AI, ratings, Tesla, Evercore, Amazon, Enterprise",2024-02-14,200.45,5.96849228166631
2024-02-13,"For a long time, going public has been a “badge of honor” for many startup founders, and is synonymous with prestige and recognition in most innovation ecosystems.
 However, once it goes public, its price will be affected by a number of factors over which it has little or no control, including macroeconomic factors, industry trends, whether the company is part of an index, and how that index performs. Any lack of transparency or conflict of interest that affects investor confidence can trigger a stock crash, causing damage to your company's market value.
   Bottom-line
  While an IPO still serves as a milestone that guarantees the company's success by a large number of independent third parties, going public requires careful consideration. Although companies may aim to balance this conflict of interest, in my experience, prices usually drop after the lockup period.",negative,0.77,"gold, FCA, SEC, SEC/FCA/FCC, Apple, IPO, founders, Amazon, FCC, financial, Tesla, Elon Musk, price, public, bureaucracy, Benzinga, macroeconomic, time, market cap, Alphabet, Barclays, market, Silicon Valley, financial reporting, company, stock, recession, Restrictions, startup, liquidity, M&A",2024-02-14,200.45,5.96849228166631
2024-02-14,"Tata Motors, India's leading automaker, has announced a significant price reduction for its electric vehicle (EV) car models.
 Tata Motors' Price Reduction for EVs
  Tata Motors, India's leading automaker, has announced a significant price reduction for its electric vehicle (EV) car models. The Federation of Automobile Dealers Associations (FADA) has reported this statistic, although specific details on EV sales have not yet been released.
  While the government has previously incentivized the adoption of electric two-wheelers through the Faster Adoption and Manufacturing of Electric Vehicles (FAME) India scheme, the subsidies have since been slashed. While the global EV market has also experienced a recent slowdown, the progression towards more affordable and accessible electric vehicles in India shows promising signs for the future of sustainable transportation in the country.
   Promising Future for Sustainable Transportation
  Despite the global EV market experiencing a recent slowdown, the progression towards more affordable and accessible electric vehicles in India shows promising signs for the future of sustainable transportation in the country.
  ",neutral,0.94,"automaker, market, adoption, US, electric two-wheelers, Tesla, Tata Motors, Motors, next, Sustainable Transportation, penetration, EV Growth, President, government, Faster Adoption, battery, FADA, Promising Future, FAME, Tata, Model Y, electric, India",2024-02-15,199.95,-1.044244283876083
2024-02-14,"Tesla launched a bid to protect its trademark after a businessman in Bury opened up “Tesla Chicken and Pizza”
 A takeaway owner who challenged Tesla has ended up £12,000 poorer after losing a fierce legal fight.
   Tesla, owned by Elon Musk, applied to invalidate Mr Ali's trademark, arguing it would take unfair advantage of its reputation. Amanj Ali, the boss of Colorado's Chicken in Bury, registered the trademark ‘Tesla Chicken and Pizza' with plans to open a new shop. Then in November 2021, the IPO told Mr Ali someone else wanted the ‘Tesla' name too, which turned out to be the car company.
   After the UK's Intellectual Property Office (IPO) ruled in Tesla's favour, Mr Ali was slapped with a £4,000 fine as well as more than £8,000 in legal costs.
  ",neutral,0.65,"electric car, sleep, Ali, trademark, Colorado, 18 months, Tesla, rock, ‘Tesla Chicken, I. It, small business, Elon Musk, Chicken, Musk, LA, trade mark, tweet, IPO, legal, social media, Nikola Tesla, UK, Amanj Ali, business, roller skates, Court, drive-in, restaurant, solicitor, money, Bury, Greater Manchester, “Tesla Chicken, pandemic, more, Elon",2024-02-15,199.95,-1.044244283876083
2024-02-15,"The AutoPacific EV Consumer Insights Study asked over 7,200 “future EV acceptors,” defined by the consulting and market-research firm as “those who
either intend to purchase or will consider purchasing an EV in the near future,” about their ideal charging experience.
   But whether it's current owners or those mulling an EV purchase, most respondents agreed that charging stations should offer similar amenities to gas stations.
   “Allowing EV owners to have a public charging experience similar to what they're used to with traditional fueling is certainly beneficial to increasing EV acceptance,” AutoPacific president Ed Kim said in a statement provided to Green Car Reports.
   Respondents pointed to gas-station features like windshield cleaner, air pumps for inflating tires, and vacuums as most-wanted features for charging stations, along with more charging-specific elements like clear signage for pricing and charging speed.
   These locations offer amenities, but not typical gas-station features like vacuums and squeegees.
  ",negative,0.52,"charging, most, future, air, Ionna, station, Tesla, AutoPacific, Ed Kim, designs, vacuums, tire, stations, perks, squeegees, Electrify America, Tesla Superchargers, Respondents, Waffle House, features",2024-02-16,199.95,0.0
2024-02-15,"Elon Musk is looking to move the legal home of SpaceX to Texas from Delaware after a judge in that state voided the billionaire's $55.8 billion Tesla pay package
 Elon Musk is looking to move the legal home of SpaceX to Texas from Delaware after a judge in that state voided the billionaire's $55.8 billion Tesla pay package.
   Last month Delaware Chancellor Kathaleen St. Jude McCormick invalidated the pay package that Tesla established for Musk in 2018, ruling that the process was “flawed” and the price “unfair.” McCormick's ruling came five years after shareholders filed a lawsuit accusing Musk and Tesla directors of breaching their duties and arguing that the pay package was a product of sham negotiations with directors who were not independent of him.
   The change by SpaceX comes just days after Musk's brain implant company Neuralink moved its legal corporate home from Delaware to Nevada.
   In her ruling, she called the package “the largest potential compensation opportunity ever observed in public markets by multiple orders of magnitude.”
  McCormick determined that Tesla's board lacked independence from Musk.",neutral,0.91,"Associated Press, Twitter, Musk, McCormick, magnitude, package, state, Elon Musk, Austin, Updated, Tesla, brain implant, Texas, Forbes, compensation, ruling, SpaceX, Jude McCormick, Delaware, billionaire, 45 mins, Chancellor, Nevada, Neuralink, Kathaleen St",2024-02-16,199.95,0.0
2024-02-16,"LEXINGTON, Ky. (WKYT) - The criminal complaint says Vann was wanted for two thefts, just 45 minutes and two-and-a-half miles apart.
   Court records show police arrested 18-year-old Korde Vann last week. A preliminary hearing has been set for the suspect wanted in two brazen computer thefts. Vann is now charged with theft.
  ",neutral,0.39,"attorney, East Tiverton, Walden, Vann, suspect, arraigned, complaint, Tesla, police, records, Tiverton, Court, computer, Lexington, Korde Vann, WKYT, LEXINGTON, preliminary hearing, court, theft, Ky",2024-02-17,199.95,0.0
2024-02-16,"Carmakers are worried.

 Last month, chairman of Japanese carmaker Toyota Akio Toyoda doubled down on his bearish stance against battery-powered EVs, arguing that hybrid EVs and hydrogen-powered cars will make up the lion's share of the market.

 Richter Fail

After racing to meet surging demand for EVs just six months ago, carmakers are now slamming the brakes and significantly cutting their plants' output.

 But while US automakers are expecting gloomier days ahead, the global EV market is far from slowing down, with consultant Rho Motion finding that a record number of EVs were sold globally in January, up 69 percent over last January.

 Seismic Change

Even Tesla CEO Elon Musk warned of ""notably lower"" growth during last month's fourth-quarter earnings call, which fell well short of expectations and left a dent in the carmaker's share value.

",negative,1,"market, Rho, Never Catch, share, Jim Farley, seismic, Japanese, bearish, F-150 Lightning, hybrid, cars, number, Toyota, F-150, Tesla, Elon Musk, last, Akio Toyoda, CEO, Ford, US, call, month, consumers, Rho Motion, WSJ, hybrids",2024-02-17,199.95,0.0
2024-02-17,"Benzinga - by Michael Cohen, Benzinga Editor.   For more bearish takes, be sure to see these posts:
  Economists Sound Alarm On Inflation's Stubborn Grip: 'No Chance Inflation Will Return To 2%' Without New Rate Hikes
  Market Correction Due: Stocks Are Running Out Of Reasons To Move Higher, Analyst Says
  EV Winter' Is Starting To Take A Toll On Rivian: Analyst Says 2024 Targets Are In Jeopardy
  Keep up with all the latest breaking news and trading ideas by following Benzinga on Twitter.
   Benzinga examined the prospects for many investors' favorite stocks over the last week — here's a look at some of our top stories.
  The three major indexes ended their five-week winning streak on Friday, influenced by unexpectedly high inflation data and raising concerns that the Federal Reserve may postpone cutting interest rates. Benzinga provides daily reports on the stocks most popular with investors.",neutral,0.91,"Producer Price, Tesla Inc, Mehab Qureshi, Tesla, Robinhood, Nasdaq, Chinese, Nvidia, bullish, Tesla Inc., Inflation, stake, peak, Disney, Neil Dennis, Analyst, AI Wave, Decentralized, Walt Disney, CRYPTO, Benzinga.com, Labor, Nvidia Corp, inflation, Elon Musk, EV Winter, increase, hedge fund, Happened, Federal Reserve, Blackwells Capital, Arista Networks, skepticism, AI-related, Nelson Peltz, SEC, cybersecurity, Jeopardy, Jason Aintabi, Josh Brown, Google, basis points, Dogecoin, Time, Murtuza Merchant, Fed, AI-Related, Musk, AI, Oracle, Michael Cohen, week, Bob Iger, Twitter, S&P 500, The Bulls, DIS, Guru, Chris Katje, Bitcoin, Grip, Benzinga Bulls, NYSE, NASDAQ, Backs Google, bearish, Dow, Giants, Adam Eckert, CNBC, ANET, anxiety, Stocks, Kickstart, Benzinga, breaking news, decentralization, CEO, Palo Alto, Hong Kong, Amazon",2024-02-18,199.95,0.0
2024-02-17,"By



The Tesla Cybertruck landed in Tokyo today, making its most recent stop in the tour across Asia.

 ba ni awọn asọye, awọn ifiyesi, tabi awọn ibeere, jọwọ fi imeeli ranṣẹ si mi joey@teslati.com. Tesla Cybertruck gbe ni ilu Tokyo, ti n tẹsiwaju irin-ajo kọja Asia









<!–

-> The Cybertruck arrived in Japan for the first time, and it drew plenty of crowds at the display event where Tesla fans from all across the country gathered to get a peek at the pickup that could quite possibly never be for sale in the region.

 Tesla and CEO Elon Musk could be using the Cybertruck to stir up sales in Japan, as he noted during the Q4 Earnings Call that sales in the market are “remarkably low.”

“We should at least have a market share proportionate to, say, other non-Japanese carmakers like Mercedes or BMW, which we do not currently have,” Musk said.

",neutral,0.47,"Chengdu, Elon Musk, Shanghai, China, Asia, charging infrastructure, Nanjing, United States, Teslas, Xi’an, Tesla, vehicles, display, Beijing, Cybertruck, Shenzhen, Musk, Emi yoo, Xi'an, CEO, awọn, market share, sales, Mercedes, Chongqing, @Tesla_Asia, joey, lati, pickup, Japan, 🇯🇵, Tokyo, internal combustion, BMW, Twitter, tabi, Model Y, Hangzhou",2024-02-18,199.95,0.0
2024-02-18,"TESLA  The Tesla Files: U.S. Military's Pursuit of Tesla's Secrets The Induction Motor, Tesla's Patent about 1887 is probably the least
understood by the masses and is as prevalent as the Wheel in modern humanity. Products today are constructed and sold for a specific purpose..like Alternators of cars, or Motors for conveyor belts or washing machines...etc etc on and on. Tesla also identified that Electricity only exists between the Ground (Earth) and a mysterious barrier at a specific altitude, today we call that barrier the Ionosphere, an electromagnetic barrier.
   Faraday identified/discovered Electromagnetism 50 years earlier than when Tesla came along. We have been steered for over 100 years by Corporate interests that want to sell a product for specific things.",neutral,0.86,"washing, shield, Earth, Faraday, Wheel, Tesla's Patent, perspective, Faraday Cage, machines, years, electricity, Westinghouse, Ionosphere, specific, U.S. Military, Tesla, nasal, Electromagnetism, humanity, today, TESLA, barrier, electromagnetic, Ground (Earth, product",2024-02-19,193.76,-1.2083821954825904
2024-02-18,"Unveiling a new chapter for electric vehicles, Tesla announced a groundbreaking update for its popular Model 3.
 Overall, the updated Model 3 represents Tesla's ongoing innovation and dedication to providing a superior driving experience in electric vehicles. This update aims to enhance the customer experience and solidify the Model 3's position as the best-selling electric vehicle worldwide.
   With its refined design, enhanced performance, and advanced features, the Model 3 will continue to lead the electric vehicle market. Additionally, Tesla introduces two new colors for the Model 3: Ultra Red, a high-chroma color with dynamic depth, and Stealth Grey, a rich dark metallic color.
  ",neutral,0.8,"driving range, subwoofers, electric, European Union, Ultra Red, front, sound system, noise, dual, metallic color, vehicle, Stealth Grey, aluminum, Model 3, Tesla, wireless, Long Range, customer experience, rear, Model, aerodynamics, glass, optimization, experience, aerodynamic, ambient",2024-02-19,193.76,-1.2083821954825904
2024-02-19,"Artificial Intelligence (AI) Supercomputer Market Research Report 2023: The report also provides an in-depth assessment of market share, growth strategies, and services, offering of leading players like NIVIDIA Corporation (US), Intel Corporation (US), Advanced Micro Devices, Inc. (US), Samsung Electronics ( South Korea ), Micron Technology, Inc. (US) among others in the AI supercomputer market. The report will provide insights into the following pointers:
 Analysis of key drivers (Increased application of AI supercomputers in the healthcare sector), restraints (High acquisition and maintenance costs), opportunities (Contribution of AI in development and deployment of autonomous vehicles), and challenges (Long development and deployment cycles) of the AI supercomputer market. Detailed insights on upcoming technologies, research & development activities, and new product & service launches in the AI supercomputer market.
  Exhaustive information about new products & services, untapped geographies, recent developments, and investments in the AI supercomputer market.
 ",neutral,0.96,"healthcare, Processors/Compute, CAGR, Huawei Technologies, 353-1-416-8900, machine learning, Artificial Intelligence, data analysis, Nvidia Corporation, AI, Inc., NVIDIA Corporation, North America, Oracle Corporation, South Korea, market share, IBM Corporation, parallel processing, market data, high-performance computing, development, Laura Wood, ResearchAndMarkets.com, data, Tesla, Inc., customer satisfaction, Intel Corporation, Atos, U.S, Inc, Micron Technology, Application (Government, NIVIDIA Corporation, Google, Samsung Electronics, GMT, Arm Limited, information, supercomputers, Fujitsu, PR Newswire, GPUs, US, report, MediaTek Inc, Microsoft, Alphabet Inc., Facebook, Cloud, supercomputer, MediaTek, Analysis, DUBLIN, Dell Inc., Supercomputer, USD, NEC Corporation, Corporation, market",2024-02-20,194.77,0.7292097641704574
2024-02-19,"DUBLIN Feb. 19, 2024 /PRNewswire/ -- The ""Artificial Intelligence (AI) Supercomputer Market by
Components (Processors/Compute, Storage, Memory, Interconnects), Deployment (Cloud, On-Premises), Application (Government, Academia and Research, Commercial) and Geography - Global Forecast to 2028"" report has been added to ResearchAndMarkets.com's offering.
   The report also provides an in-depth assessment of market share, growth strategies, and services, offering of leading players like NIVIDIA Corporation (US), Intel Corporation (US), Advanced Micro Devices, Inc. (US), Samsung Electronics ( South Korea ), Micron Technology, Inc. (US) among others in the AI supercomputer market.
   The report will provide insights into the following pointers:
  Analysis of key drivers (Increased application of AI supercomputers in the healthcare sector), restraints (High acquisition and maintenance costs), opportunities (Contribution of AI in development and deployment of autonomous vehicles), and challenges (Long development and deployment cycles) of the AI supercomputer market.
   Exhaustive information about new products & services, untapped geographies, recent developments, and investments in the AI supercomputer market.
   Detailed insights on upcoming technologies, research & development activities, and new product & service launches in the AI supercomputer market.
  ",neutral,0.95,"Inc., machine learning, market share, Application (Government, /et_pb_code, Tesla, Inc, AI, Company, NEC Corporation, USD, Groq, Inc, Sambanova Systems, Processors/Compute, Analysis, Graphcore, Supercomputer, market, GPUs, Profiles, Media Contact, 353-1-416-8900, ResearchAndMarkets.com, Cerebras, MediaTek Inc, US, Intel Corporation, Facebook, Dell Inc., U.S, data analysis, Fujitsu, IBM Corporation, Cloud, Google, high-performance computing, Research, Tesla, Inc., MediaTek, Nvidia Corporation, customer satisfaction, Atos, development, Huawei Technologies, Alphabet Inc., https://mma.prnewswire.com/media/539438/Research_and_Markets_Logo.jpg, Micron Technology, NIVIDIA Corporation, GMT, NVIDIA Corporation, South Korea, healthcare, Microsoft, Oracle Corporation, parallel processing, CAGR, Market Development, Dell Inc, supercomputer, report, information, Laura Wood, Samsung Electronics, Arm Limited, supercomputers, Artificial Intelligence, Corporation, North America, DUBLIN, Pezy Group",2024-02-20,194.77,0.7292097641704574
2024-02-20,"Two Senators have purchased a series of bonds in states they represent, raising concerns about potential conflicts of interest, and experts spoke to Newsweek on the matter.

 According to an analysis of stock data aggregated by Quiver Quantitative, Republican Oklahoma Senator Markwayne Mullin and Democratic Virginia Senator Mark Warner have collectively purchased 10 bonds worth as much as $3,450,000 since January.

 [The Ending Trading and Holdings in Congressional Stocks Act] and other legislation that would make conflicts of interest like this one impossible.""

Meanewhile, Dr. Seth C. McKee, a political science professor at Oklahoma State University, said the bonds could be seen as ""problematic.""

""I would never profess to be an expert on financial matters like these,"" he told Newsweek. On January 18, Mullin, who sits on the Senate committee on health, education, labor and pension, purchased a bond valued at between $50,001 and $100,000 in Oklahoma State University Agricultural, a university that receives federal and state funding.

 On January 11, he purchased a bond worth between $50,001 and $100,000 from the Virginia Resources Authority, which issues loans in the state for public work.

",neutral,0.91,"district, nonpartisan, university, survey, Senator, municipal bonds, drug development, pension, Amazon, Markwayne Mullin, Tulsa, Republican, Washington, Gaetz, Quiver Quantitative, Paul, Missouri, Getty Images, Congressional, McClain County, Unusual Whales, biotechnology, tax exemption, public improvement, Ocasio-Cortez, stock, Christopher Phelps, Oklahoma, bond, municipal bond, January, privy, Richmond, Josh Hawley, California, stock trading, Anna Moneymaker, Newsweek, Nottingham, Oklahoma County, net worth, Markwayne, Political Science, Nancy Pelosi, Acumen Pharmaceuticals, economic development, Virginia, Kevin Dietsch, Democrat, political science, Washington, D.C., Apple, trustee, Congress, Mullin, Microsoft, House, tax evasion, Warner, Tesla, U.S, Maryland, D.C, Matt Gaetz, state, Adjunct, public, Left, Alzheimer, Despite, New York, Texas, Mark Warner, blind trust, bonds, Petersburg, David O'Brien, Senate, Tulsa County, insider trading, Alexandria, Broken Arrow, stock market, RepresentUS, Oklahoma Senator, Pelosi",2024-02-21,197.41,1.757731958762885
2024-02-20,"Barclays analyst Christine Cho said in a note Tuesday that Tesla's (NASDAQ: TSLA) Powerwall home energy storage product still leads ...
  This is a premium only article. To continue reading this and other premium stock market news articles please sign-in or upgrade to StreetInsider.com Premium below (Free Trial) LEARN MORE
  Member Login",neutral,0.67,"premium, energy storage, StreetInsider.com Premium, articles, StreetInsider.com, Christine Cho, NASDAQ, Trial, Barclays, SolarEdge Technologies, stock market, MORE, Free, Premium, Powerwall, Tesla",2024-02-21,197.41,1.757731958762885
